{
  "meta": {
    "dataVersion": "0.1.0",
    "extractedOn": "2026-10-18",
    "complete": true,
    "tier": "srd",
    "textPolicy": "srd-verbatim",
    "attribution": "This work includes material from the System Reference Document 5.2.1 (\"SRD 5.2.1\") by Wizards of the Coast LLC, available at https://www.dndbeyond.com/srd. The SRD 5.2.1 is licensed under the Creative Commons Attribution 4.0 International License, available at https://creativecommons.org/licenses/by/4.0/legalcode.",
    "notes": "The core rules a character sheet acts on, from Playing the Game (pp.5-18), Character Creation (pp.19-26) and the Rules Glossary (pp.176-191), plus three rules that live elsewhere: Light (two-weapon fighting, p.89), Attunement (p.102) and the six abilities. Left out on purpose, as things a sheet does not act on: the rhythm of play, social interaction, exploration (vision, hiding, objects, marching order), hazards, travel, the grid, cover, mounted and underwater combat, alignment, tiers of play, trinkets, Knocking Out a Creature, and the glossary's definitions of areas of effect, attitudes, objects, hazards, movement modes (Climbing, Crawling, Swimming, Flying, Jumping), terrain, light and obscurement, creature types, curses, illusions, possession, shape-shifting, telepathy, teleportation, stat blocks and the like. Glossary entries that only point to a chapter rule recorded here (Ability Check, Attack Roll, Critical Hit, Death Saving Throw, Healing, Hit Points, Immunity, Proficiency, Resistance, Vulnerability, Round Down, Temporary Hit Points, Experience Points, Stable) are not recorded twice. Skills and the skill rules are in skills.json; conditions in conditions.json; the Spells chapter's rules in spellcasting.json; formulas in derivations.json. abilityModifiers is the full Ability Modifiers table (p.6, scores 1-30); the Ability Scores and Modifiers table (p.21) prints the 3-20 rows of it, identically. The D20 Tests steps are printed numbered 4 to 6."
  },
  "abilities": [
    {
      "id": "str",
      "name": "Strength",
      "measures": "Physical might",
      "source": {
        "ref": "srd-5.2.1",
        "section": "Playing the Game > The Six Abilities",
        "page": 5,
        "table": "Ability Descriptions"
      },
      "confidence": "printed"
    },
    {
      "id": "dex",
      "name": "Dexterity",
      "measures": "Agility, reflexes, and balance",
      "source": {
        "ref": "srd-5.2.1",
        "section": "Playing the Game > The Six Abilities",
        "page": 5,
        "table": "Ability Descriptions"
      },
      "confidence": "printed"
    },
    {
      "id": "con",
      "name": "Constitution",
      "measures": "Health and stamina",
      "source": {
        "ref": "srd-5.2.1",
        "section": "Playing the Game > The Six Abilities",
        "page": 5,
        "table": "Ability Descriptions"
      },
      "confidence": "printed"
    },
    {
      "id": "int",
      "name": "Intelligence",
      "measures": "Reasoning and memory",
      "source": {
        "ref": "srd-5.2.1",
        "section": "Playing the Game > The Six Abilities",
        "page": 5,
        "table": "Ability Descriptions"
      },
      "confidence": "printed"
    },
    {
      "id": "wis",
      "name": "Wisdom",
      "measures": "Perceptiveness and mental fortitude",
      "source": {
        "ref": "srd-5.2.1",
        "section": "Playing the Game > The Six Abilities",
        "page": 5,
        "table": "Ability Descriptions"
      },
      "confidence": "printed"
    },
    {
      "id": "cha",
      "name": "Charisma",
      "measures": "Confidence, poise, and charm",
      "source": {
        "ref": "srd-5.2.1",
        "section": "Playing the Game > The Six Abilities",
        "page": 5,
        "table": "Ability Descriptions"
      },
      "confidence": "printed"
    }
  ],
  "abilityModifiers": [
    {
      "min": 1,
      "max": 1,
      "modifier": -5
    },
    {
      "min": 2,
      "max": 3,
      "modifier": -4
    },
    {
      "min": 4,
      "max": 5,
      "modifier": -3
    },
    {
      "min": 6,
      "max": 7,
      "modifier": -2
    },
    {
      "min": 8,
      "max": 9,
      "modifier": -1
    },
    {
      "min": 10,
      "max": 11,
      "modifier": 0
    },
    {
      "min": 12,
      "max": 13,
      "modifier": 1
    },
    {
      "min": 14,
      "max": 15,
      "modifier": 2
    },
    {
      "min": 16,
      "max": 17,
      "modifier": 3
    },
    {
      "min": 18,
      "max": 19,
      "modifier": 4
    },
    {
      "min": 20,
      "max": 21,
      "modifier": 5
    },
    {
      "min": 22,
      "max": 23,
      "modifier": 6
    },
    {
      "min": 24,
      "max": 25,
      "modifier": 7
    },
    {
      "min": 26,
      "max": 27,
      "modifier": 8
    },
    {
      "min": 28,
      "max": 29,
      "modifier": 9
    },
    {
      "min": 30,
      "max": 30,
      "modifier": 10
    }
  ],
  "advancement": [
    {
      "level": 1,
      "xp": 0,
      "proficiencyBonus": 2
    },
    {
      "level": 2,
      "xp": 300,
      "proficiencyBonus": 2
    },
    {
      "level": 3,
      "xp": 900,
      "proficiencyBonus": 2
    },
    {
      "level": 4,
      "xp": 2700,
      "proficiencyBonus": 2
    },
    {
      "level": 5,
      "xp": 6500,
      "proficiencyBonus": 3
    },
    {
      "level": 6,
      "xp": 14000,
      "proficiencyBonus": 3
    },
    {
      "level": 7,
      "xp": 23000,
      "proficiencyBonus": 3
    },
    {
      "level": 8,
      "xp": 34000,
      "proficiencyBonus": 3
    },
    {
      "level": 9,
      "xp": 48000,
      "proficiencyBonus": 4
    },
    {
      "level": 10,
      "xp": 64000,
      "proficiencyBonus": 4
    },
    {
      "level": 11,
      "xp": 85000,
      "proficiencyBonus": 4
    },
    {
      "level": 12,
      "xp": 100000,
      "proficiencyBonus": 4
    },
    {
      "level": 13,
      "xp": 120000,
      "proficiencyBonus": 5
    },
    {
      "level": 14,
      "xp": 140000,
      "proficiencyBonus": 5
    },
    {
      "level": 15,
      "xp": 165000,
      "proficiencyBonus": 5
    },
    {
      "level": 16,
      "xp": 195000,
      "proficiencyBonus": 5
    },
    {
      "level": 17,
      "xp": 225000,
      "proficiencyBonus": 6
    },
    {
      "level": 18,
      "xp": 265000,
      "proficiencyBonus": 6
    },
    {
      "level": 19,
      "xp": 305000,
      "proficiencyBonus": 6
    },
    {
      "level": 20,
      "xp": 355000,
      "proficiencyBonus": 6
    }
  ],
  "advancementSource": {
    "ref": "srd-5.2.1",
    "section": "Character Creation > Level Advancement",
    "page": 23,
    "table": "Character Advancement"
  },
  "languages": [
    {
      "id": "common",
      "name": "Common",
      "kind": "standard",
      "source": {
        "ref": "srd-5.2.1",
        "section": "Character Creation > Step 2: Character Origin > Choose Languages",
        "page": 20,
        "table": "Standard Languages"
      },
      "confidence": "printed",
      "note": "1d12: — (every player character knows Common)."
    },
    {
      "id": "common-sign-language",
      "name": "Common Sign Language",
      "kind": "standard",
      "source": {
        "ref": "srd-5.2.1",
        "section": "Character Creation > Step 2: Character Origin > Choose Languages",
        "page": 20,
        "table": "Standard Languages"
      },
      "confidence": "printed",
      "note": "1d12: 1."
    },
    {
      "id": "draconic",
      "name": "Draconic",
      "kind": "standard",
      "source": {
        "ref": "srd-5.2.1",
        "section": "Character Creation > Step 2: Character Origin > Choose Languages",
        "page": 20,
        "table": "Standard Languages"
      },
      "confidence": "printed",
      "note": "1d12: 2."
    },
    {
      "id": "dwarvish",
      "name": "Dwarvish",
      "kind": "standard",
      "source": {
        "ref": "srd-5.2.1",
        "section": "Character Creation > Step 2: Character Origin > Choose Languages",
        "page": 20,
        "table": "Standard Languages"
      },
      "confidence": "printed",
      "note": "1d12: 3–4."
    },
    {
      "id": "elvish",
      "name": "Elvish",
      "kind": "standard",
      "source": {
        "ref": "srd-5.2.1",
        "section": "Character Creation > Step 2: Character Origin > Choose Languages",
        "page": 20,
        "table": "Standard Languages"
      },
      "confidence": "printed",
      "note": "1d12: 5–6."
    },
    {
      "id": "giant",
      "name": "Giant",
      "kind": "standard",
      "source": {
        "ref": "srd-5.2.1",
        "section": "Character Creation > Step 2: Character Origin > Choose Languages",
        "page": 20,
        "table": "Standard Languages"
      },
      "confidence": "printed",
      "note": "1d12: 7."
    },
    {
      "id": "gnomish",
      "name": "Gnomish",
      "kind": "standard",
      "source": {
        "ref": "srd-5.2.1",
        "section": "Character Creation > Step 2: Character Origin > Choose Languages",
        "page": 20,
        "table": "Standard Languages"
      },
      "confidence": "printed",
      "note": "1d12: 8."
    },
    {
      "id": "goblin",
      "name": "Goblin",
      "kind": "standard",
      "source": {
        "ref": "srd-5.2.1",
        "section": "Character Creation > Step 2: Character Origin > Choose Languages",
        "page": 20,
        "table": "Standard Languages"
      },
      "confidence": "printed",
      "note": "1d12: 9."
    },
    {
      "id": "halfling",
      "name": "Halfling",
      "kind": "standard",
      "source": {
        "ref": "srd-5.2.1",
        "section": "Character Creation > Step 2: Character Origin > Choose Languages",
        "page": 20,
        "table": "Standard Languages"
      },
      "confidence": "printed",
      "note": "1d12: 10–11."
    },
    {
      "id": "orc",
      "name": "Orc",
      "kind": "standard",
      "source": {
        "ref": "srd-5.2.1",